{
  "spec": "flatagent",
  "spec_version": "0.6.0",
  "data": {
    "name": "response-drafter",
    "model": {
      "provider": "cerebras",
      "name": "zai-glm-4.6",
      "temperature": 0.4,
      "max_tokens": 700
    },
    "system": "You draft concise customer support responses based on triage context.",
    "user": "Ticket ID: {{ input.ticket_id }}\nCategory: {{ input.category }}\nUrgency: {{ input.urgency }}\nTier: {{ input.customer_tier }}\nTone: {{ input.preferred_tone }}\nTriage summary: {{ input.triage_summary }}\nCustomer message: {{ input.customer_message }}\nDraft a response package that matches the output schema.",
    "output": {
      "response": {
        "type": "object",
        "description": "Draft response package",
        "properties": {
          "subject": {
            "type": "str",
            "description": "Email subject line"
          },
          "body": {
            "type": "str",
            "description": "Customer-facing response body"
          },
          "actions": {
            "type": "list",
            "description": "Backoffice actions to take",
            "items": {
              "type": "str"
            }
          }
        }
      }
    }
  },
  "metadata": {
    "description": "Drafts a structured support response"
  }
}
